{
  "$schema": "https://json-schema.org/draft/2020-12/schema",
  "$id": "https://project-skills.dev/schemas/code-audit-findings/2.2.0",
  "title": "Code Audit Findings",
  "type": "object",
  "additionalProperties": false,
  "required": ["schemaVersion", "auditId", "generatedAt", "scope", "provenance", "coverage", "summary", "findings", "limitations"],
  "properties": {
    "schemaVersion": { "enum": ["1.0.0", "2.0.0", "2.1.0", "2.2.0"] },
    "auditRunId": { "type": "string", "format": "uuid" },
    "auditEvidence": { "type": "object", "additionalProperties": false, "required": ["path", "sha256"], "properties": { "path": { "type": "string", "pattern": "^reports/audit-evidence/[a-fA-F0-9]{64}\\.json$" }, "sha256": { "type": "string", "pattern": "^[a-fA-F0-9]{64}$" } } },
    "auditId": { "type": "string", "minLength": 1 },
    "generatedAt": { "type": "string", "format": "date-time" },
    "scope": {
      "type": "object",
      "additionalProperties": false,
      "required": ["repository", "revision", "included", "excluded"],
      "properties": {
        "repository": { "type": "string" },
        "revision": { "type": "string" },
        "included": { "type": "array", "items": { "type": "string" } },
        "excluded": { "type": "array", "items": { "type": "string" } }
      }
    },
    "provenance": {
      "type": "array",
      "items": {
        "type": "object",
        "additionalProperties": false,
        "required": ["tool", "version", "command", "status"],
        "properties": {
          "tool": { "type": "string" },
          "version": { "type": "string" },
          "command": { "type": "string" },
          "status": { "enum": ["passed", "failed", "blocked", "skipped", "degraded"] },
          "exitCode": { "type": ["integer", "null"] },
          "notes": { "type": "string" }
        }
      }
    },
    "coverage": {
      "type": "array",
      "minItems": 8,
      "maxItems": 8,
      "uniqueItems": true,
      "allOf": [
        { "contains": { "type": "object", "properties": { "area": { "const": "security" } }, "required": ["area"] } },
        { "contains": { "type": "object", "properties": { "area": { "const": "correctness-reliability" } }, "required": ["area"] } },
        { "contains": { "type": "object", "properties": { "area": { "const": "resource-management" } }, "required": ["area"] } },
        { "contains": { "type": "object", "properties": { "area": { "const": "performance" } }, "required": ["area"] } },
        { "contains": { "type": "object", "properties": { "area": { "const": "dependencies-configuration" } }, "required": ["area"] } },
        { "contains": { "type": "object", "properties": { "area": { "const": "code-hygiene" } }, "required": ["area"] } },
        { "contains": { "type": "object", "properties": { "area": { "const": "design-maintainability" } }, "required": ["area"] } },
        { "contains": { "type": "object", "properties": { "area": { "const": "tests-operability" } }, "required": ["area"] } }
      ],
      "items": {
        "type": "object",
        "additionalProperties": false,
        "required": ["area", "status", "checks", "evidence", "limitations"],
        "properties": {
          "area": { "enum": ["security", "correctness-reliability", "resource-management", "performance", "dependencies-configuration", "code-hygiene", "design-maintainability", "tests-operability"] },
          "status": { "enum": ["completed", "partial", "blocked", "not-applicable", "failed"] },
          "checks": { "type": "array", "minItems": 1, "items": { "type": "string" } },
          "evidence": { "type": "array", "items": { "type": "string" } },
          "limitations": { "type": "array", "items": { "type": "string" } }
        }
      }
    },
    "summary": {
      "type": "object",
      "required": ["total", "bySecuritySeverity", "byCategory"],
      "properties": {
        "total": { "type": "integer", "minimum": 0 },
        "bySecuritySeverity": { "type": "object" },
        "byCategory": { "type": "object" }
      }
    },
    "repositoryEvidence": {
      "type": "object",
      "additionalProperties": false,
      "required": ["localGit", "secretScanning", "hostedRepository"],
      "properties": {
        "localGit": {
          "type": "object",
          "additionalProperties": false,
          "required": ["status", "revision", "worktreeDirty", "shallow", "reachableCommitCount", "scannedRefs", "limitations"],
          "properties": {
            "status": { "enum": ["completed", "partial", "blocked", "failed"] },
            "revision": { "type": "string", "minLength": 1 },
            "worktreeDirty": { "type": "boolean" },
            "shallow": { "type": "boolean" },
            "reachableCommitCount": { "type": "integer", "minimum": 0 },
            "scannedRefs": { "type": "array", "items": { "type": "string", "minLength": 1 } },
            "limitations": { "type": "array", "items": { "type": "string" } }
          }
        },
        "secretScanning": {
          "type": "object",
          "additionalProperties": false,
          "required": ["status", "scanner", "version", "configurationDigest", "scopes", "findingCount", "limitations"],
          "properties": {
            "status": { "enum": ["completed", "partial", "blocked", "failed"] },
            "scanner": { "type": "string", "minLength": 1 },
            "version": { "type": ["string", "null"] },
            "configurationDigest": {
              "oneOf": [
                { "type": "string", "pattern": "^[a-fA-F0-9]{64}$" },
                { "type": "null" }
              ]
            },
            "scopes": { "type": "array", "items": { "type": "string", "minLength": 1 } },
            "findingCount": { "type": "integer", "minimum": 0 },
            "limitations": { "type": "array", "items": { "type": "string" } }
          }
        },
        "hostedRepository": {
          "type": "object",
          "additionalProperties": false,
          "required": ["provider", "status", "checkedAt", "controls", "limitations"],
          "properties": {
            "provider": { "enum": ["github", "azure-devops", "gitlab", "other", "none"] },
            "status": { "enum": ["completed", "partial", "blocked", "not-applicable", "failed"] },
            "checkedAt": { "type": ["string", "null"], "format": "date-time" },
            "controls": { "type": "array", "items": { "$ref": "#/$defs/controlAssessment" } },
            "limitations": { "type": "array", "items": { "type": "string" } }
          }
        }
      }
    },
    "standards": {
      "type": "array",
      "minItems": 1,
      "items": { "$ref": "#/$defs/standardAssessment" }
    },
    "assurance": {
      "type": "object",
      "additionalProperties": false,
      "required": ["conclusion", "rationale", "blockingEvidence", "exceptionCount", "expiredExceptionCount"],
      "properties": {
        "conclusion": { "enum": ["conformant", "conformant-with-exceptions", "non-conformant", "insufficient-evidence"] },
        "rationale": { "type": "string", "minLength": 1 },
        "blockingEvidence": { "type": "array", "items": { "type": "string" } },
        "exceptionCount": { "type": "integer", "minimum": 0 },
        "expiredExceptionCount": { "type": "integer", "minimum": 0 }
      }
    },
    "verificationEvidence": {
      "type": "object",
      "additionalProperties": false,
      "required": ["secretExposure", "analyzers", "resourceOwnership", "aiQuality", "assuranceGates"],
      "properties": {
        "secretExposure": { "$ref": "#/$defs/secretExposureAssessment" },
        "analyzers": { "$ref": "#/$defs/analyzerAssessment" },
        "resourceOwnership": { "$ref": "#/$defs/resourceOwnershipAssessment" },
        "aiQuality": { "$ref": "#/$defs/aiQualityAssessment" },
        "assuranceGates": { "$ref": "#/$defs/assuranceGateAssessment" },
        "records": { "type": "array", "minItems": 1, "items": { "$ref": "#/$defs/verificationRecord" } }
      }
    },
    "findings": {
      "type": "array",
      "items": { "$ref": "#/$defs/finding" }
    },
    "limitations": { "type": "array", "items": { "type": "string" } }
  },
  "allOf": [
    {
      "if": { "properties": { "schemaVersion": { "const": "2.0.0" } }, "required": ["schemaVersion"] },
      "then": { "required": ["repositoryEvidence", "standards", "assurance"] }
    },
    {
      "if": { "properties": { "schemaVersion": { "const": "2.1.0" } }, "required": ["schemaVersion"] },
      "then": {
        "required": ["repositoryEvidence", "standards", "assurance", "verificationEvidence"],
        "properties": {
          "standards": {
            "items": { "required": ["stability", "baselineRole"] }
          }
        }
      }
    },
    {
      "if": { "properties": { "schemaVersion": { "const": "2.2.0" } }, "required": ["schemaVersion"] },
      "then": {
        "required": ["auditRunId", "auditEvidence", "repositoryEvidence", "standards", "assurance", "verificationEvidence"],
        "properties": { "standards": { "items": { "required": ["stability", "baselineRole"] } }, "verificationEvidence": { "required": ["records"] } }
      }
    }
  ],
  "$defs": {
    "verificationRecord": {
      "type": "object",
      "additionalProperties": false,
      "required": ["auditRunId", "tool", "toolVersion", "command", "scope", "configurationDigest", "exitCode", "status", "executedAt", "evidenceSha256", "repositoryRevision"],
      "properties": {
        "auditRunId": { "type": "string", "format": "uuid" },
        "tool": { "type": "string", "minLength": 1 },
        "toolVersion": { "type": "string", "minLength": 1 },
        "command": { "type": "string", "minLength": 1 },
        "scope": { "type": "string", "minLength": 1 },
        "configurationDigest": { "type": ["string", "null"], "pattern": "^[a-fA-F0-9]{64}$" },
        "exitCode": { "type": ["integer", "null"] },
        "status": { "enum": ["passed", "failed", "blocked", "skipped", "degraded"] },
        "executedAt": { "type": "string", "format": "date-time" },
        "evidenceSha256": { "type": "string", "pattern": "^[a-fA-F0-9]{64}$" },
        "repositoryRevision": { "type": "string", "pattern": "^[a-fA-F0-9]{40,64}$" },
        "worktreeDigest": { "type": "string", "pattern": "^[a-fA-F0-9]{64}$" },
        "inputDigest": { "type": "string", "pattern": "^[a-fA-F0-9]{64}$" }
      }
    },
    "verificationStatus": {
      "enum": ["completed", "partial", "blocked", "not-applicable", "failed"]
    },
    "secretExposureAssessment": {
      "type": "object",
      "additionalProperties": false,
      "required": ["status", "scopes", "evidence", "limitations"],
      "properties": {
        "status": { "$ref": "#/$defs/verificationStatus" },
        "scopes": { "type": "array", "minItems": 1, "uniqueItems": true, "items": { "type": "string", "minLength": 1 } },
        "evidence": { "type": "array", "items": { "type": "string", "minLength": 1 } },
        "limitations": { "type": "array", "items": { "type": "string", "minLength": 1 } }
      }
    },
    "analyzerAssessment": {
      "type": "object",
      "additionalProperties": false,
      "required": ["status", "detectedLanguages", "tools", "evidence", "limitations"],
      "properties": {
        "status": { "$ref": "#/$defs/verificationStatus" },
        "detectedLanguages": { "type": "array", "uniqueItems": true, "items": { "type": "string", "minLength": 1 } },
        "tools": {
          "type": "array",
          "items": {
            "type": "object",
            "additionalProperties": false,
            "required": ["language", "tool", "version", "status"],
            "properties": {
              "language": { "type": "string", "minLength": 1 },
              "tool": { "type": "string", "minLength": 1 },
              "version": { "type": ["string", "null"] },
              "status": { "enum": ["passed", "failed", "blocked", "skipped", "degraded"] },
              "configurationDigest": { "type": ["string", "null"], "pattern": "^[a-fA-F0-9]{64}$" }
            }
          }
        },
        "evidence": { "type": "array", "items": { "type": "string", "minLength": 1 } },
        "limitations": { "type": "array", "items": { "type": "string", "minLength": 1 } }
      }
    },
    "resourceOwnershipAssessment": {
      "type": "object",
      "additionalProperties": false,
      "required": ["status", "ownershipModels", "checks", "pathsChecked", "evidence", "limitations"],
      "properties": {
        "status": { "$ref": "#/$defs/verificationStatus" },
        "ownershipModels": { "type": "array", "minItems": 1, "uniqueItems": true, "items": { "enum": ["locally-owned", "borrowed", "dependency-injection-owned", "pooled", "shared", "factory-managed", "framework-owned", "not-applicable"] } },
        "checks": { "type": "array", "minItems": 1, "uniqueItems": true, "items": { "type": "string", "minLength": 1 } },
        "pathsChecked": { "type": "array", "items": { "type": "string", "minLength": 1 } },
        "evidence": { "type": "array", "items": { "type": "string", "minLength": 1 } },
        "limitations": { "type": "array", "items": { "type": "string", "minLength": 1 } }
      }
    },
    "aiQualityAssessment": {
      "type": "object",
      "additionalProperties": false,
      "required": ["status", "aiComponentsDetected", "checks", "evidence", "limitations"],
      "properties": {
        "status": { "$ref": "#/$defs/verificationStatus" },
        "aiComponentsDetected": { "type": "boolean" },
        "checks": { "type": "array", "minItems": 1, "uniqueItems": true, "items": { "type": "string", "minLength": 1 } },
        "evidence": { "type": "array", "items": { "type": "string", "minLength": 1 } },
        "limitations": { "type": "array", "items": { "type": "string", "minLength": 1 } }
      }
    },
    "assuranceGateAssessment": {
      "type": "object",
      "additionalProperties": false,
      "required": ["status", "gates", "evidence", "limitations"],
      "properties": {
        "status": { "$ref": "#/$defs/verificationStatus" },
        "gates": { "type": "array", "minItems": 1, "uniqueItems": true, "items": { "type": "string", "minLength": 1 } },
        "evidence": { "type": "array", "items": { "type": "string", "minLength": 1 } },
        "limitations": { "type": "array", "items": { "type": "string", "minLength": 1 } }
      }
    },
    "controlAssessment": {
      "type": "object",
      "additionalProperties": false,
      "required": ["id", "title", "status", "evidence", "limitations"],
      "properties": {
        "id": { "type": "string", "minLength": 1 },
        "title": { "type": "string", "minLength": 1 },
        "status": { "enum": ["conformant", "exception", "non-conformant", "not-applicable", "blocked"] },
        "evidence": { "type": "array", "items": { "type": "string" } },
        "limitations": { "type": "array", "items": { "type": "string" } },
        "exceptionOwner": { "type": "string" },
        "exceptionExpiresAt": { "type": "string", "format": "date-time" }
      }
    },
    "standardAssessment": {
      "type": "object",
      "additionalProperties": false,
      "required": ["id", "title", "publisher", "version", "reference", "accessedAt", "applicability", "controls"],
      "properties": {
        "id": { "type": "string", "minLength": 1 },
        "title": { "type": "string", "minLength": 1 },
        "publisher": { "type": "string", "minLength": 1 },
        "version": { "type": "string", "minLength": 1 },
        "reference": { "type": "string", "format": "uri" },
        "accessedAt": { "type": "string", "format": "date" },
        "applicability": { "enum": ["applicable", "partially-applicable", "not-applicable"] },
        "stability": { "enum": ["stable", "final", "current", "preview", "draft"] },
        "baselineRole": { "enum": ["normative", "informational"] },
        "rationale": { "type": "string" },
        "controls": { "type": "array", "items": { "$ref": "#/$defs/controlAssessment" } }
      }
    },
    "evidence": {
      "type": "object",
      "additionalProperties": false,
      "required": ["path", "description"],
      "properties": {
        "path": { "type": "string" },
        "startLine": { "type": "integer", "minimum": 1 },
        "endLine": { "type": "integer", "minimum": 1 },
        "description": { "type": "string", "minLength": 1 }
      }
    },
    "reference": {
      "type": "object",
      "additionalProperties": false,
      "required": ["title", "publisher", "url", "accessedAt", "kind"],
      "properties": {
        "title": { "type": "string" },
        "publisher": { "type": "string" },
        "url": { "type": "string", "format": "uri" },
        "accessedAt": { "type": "string", "format": "date" },
        "kind": { "enum": ["microsoft", "industry", "vendor", "standard"] }
      }
    },
    "finding": {
      "type": "object",
      "additionalProperties": false,
      "required": ["id", "title", "category", "bugType", "securitySeverity", "confidence", "observedBehavior", "expectedBehavior", "impact", "likelihood", "evidence", "resolution", "verification", "references"],
      "properties": {
        "id": { "type": "string", "pattern": "^AUD-[0-9]{4,}$" },
        "title": { "type": "string", "minLength": 1 },
        "category": { "enum": ["security", "correctness", "reliability", "resource-management", "concurrency", "performance", "dependency", "configuration", "code-hygiene", "architecture", "testing", "operability", "accessibility", "privacy", "maintainability"] },
        "bugType": { "type": "string", "minLength": 1 },
        "securitySeverity": { "enum": ["critical", "high", "medium", "low", "none"] },
        "confidence": { "enum": ["high", "medium", "low"] },
        "cwe": { "type": "array", "items": { "type": "string", "pattern": "^CWE-[0-9]+$" } },
        "cvss": { "type": "object", "required": ["version", "vector", "score"], "properties": { "version": { "type": "string" }, "vector": { "type": "string" }, "score": { "type": "number", "minimum": 0, "maximum": 10 } } },
        "observedBehavior": { "type": "string", "minLength": 1 },
        "expectedBehavior": { "type": "string", "minLength": 1 },
        "impact": { "type": "string", "minLength": 1 },
        "likelihood": { "enum": ["high", "medium", "low", "not-applicable"] },
        "evidence": { "type": "array", "minItems": 1, "items": { "$ref": "#/$defs/evidence" } },
        "affectedLocations": { "type": "array", "items": { "$ref": "#/$defs/evidence" } },
        "resolution": { "type": "string", "minLength": 1 },
        "verification": { "type": "array", "minItems": 1, "items": { "type": "string" } },
        "references": { "type": "array", "items": { "$ref": "#/$defs/reference" } },
        "assumptions": { "type": "array", "items": { "type": "string" } }
      }
    }
  }
}
