{
  "schemaVersion": "2.0.0",
  "auditId": "AUDIT-2026-09-05-PSO-125",
  "generatedAt": "2026-09-05T17:10:00.000Z",
  "scope": {
    "repository": "Skills-Orchestrator",
    "revision": "519095930b7deb08606380e7ea9f014ff2b07416 plus report-only evidence updates",
    "included": [
      "Current tracked, staged, unstaged, and untracked distributable files, including reports and generated evidence.",
      "All 31 commits reachable from locally available branches, tags, and remote-tracking refs through pinned Gitleaks 8.30.1.",
      "Security, correctness, reliability, resource management, performance, dependencies, configuration, hygiene, architecture, tests, and operability.",
      "Microsoft SDL, Microsoft Cloud Security Benchmark, Azure Well-Architected Security, OWASP, NIST SSDF, CIS Controls, SLSA, and OpenSSF applicability readiness."
    ],
    "excluded": [
      "Remote-only refs, forks, pull-request refs, issue/discussion/wiki content, packages, and caches not represented by approved API evidence.",
      "Unreachable or pruned Git objects and live credential validation.",
      "Package registries, advisory services, Azure environments, deployment, publication, commit, and push."
    ]
  },
  "provenance": [
    {
      "tool": "audit-evidence.mjs",
      "version": "1.0.0",
      "command": "node .github/skills/audit-code/scripts/audit-evidence.mjs",
      "status": "passed",
      "exitCode": 0,
      "notes": "Full clone; 31 reachable commits, 4 local branches, 2 remote-tracking refs, 1 tag, 271 tracked files, and 77 tracked reports. Specialist evidence will be refreshed after report-only audit updates."
    },
    {
      "tool": "Project Skills Orchestrator security scanner",
      "version": "1.1.1",
      "command": "npm run security",
      "status": "passed",
      "exitCode": 0,
      "notes": "196 current files scanned and no findings; this built-in scanner remains defense in depth beside Gitleaks."
    },
    {
      "tool": "Gitleaks",
      "version": "8.30.1",
      "command": "npm run security:gitleaks",
      "status": "passed",
      "exitCode": 0,
      "notes": "Official checksum manifest and platform archive SHA-256 verified; worktree, staged index, tracked reports, ignored distributable files, all local refs, and reachable history passed with full redaction and zero findings. Remote-only refs and unreachable objects remain excluded."
    },
    {
      "tool": "npm repository gate",
      "version": "1.1.1",
      "command": "npm run check",
      "status": "passed",
      "exitCode": 0,
      "notes": "107 tests passed with one platform-alias skip, security scanned 198 files, 151 release-candidate files verified, and 43 skills passed distribution verification."
    },
    {
      "tool": "VS Code diagnostics",
      "version": "current workspace",
      "command": "get_errors",
      "status": "passed",
      "exitCode": 0,
      "notes": "No current diagnostics were reported."
    }
  ],
  "coverage": [
    {
      "area": "security",
      "status": "partial",
      "checks": ["Current-tree built-in scan", "Pinned worktree/index/report/all-ref/history scan", "Schema assurance review", "Release-gate review"],
      "evidence": ["npm run security passed for 196 files.", "Gitleaks 8.30.1 passed all approved local scopes with zero findings and full redaction.", "Hosted branch, secret, dependency, Actions, CodeQL, and vulnerability controls were inspected and hardened.", "AUD-0205 records the remaining trusted-signature and independent-review gap."],
      "limitations": ["Required human review is not enforceable until a second qualified collaborator exists.", "Remote-only refs and unreachable objects were not scanned.", "No external advisory or current standards retrieval."]
    },
    {
      "area": "correctness-reliability",
      "status": "completed",
      "checks": ["Complete repository test suite", "Audit pipeline schema and dependency review", "Execution state contract review"],
      "evidence": ["npm run check passed 107 tests with one local platform-alias skip.", "The blocked P4 schema 3.0 execution artifact validates against immutable PSO-124 snapshot 040dad9a.", "Canonical plan replacement and macOS root-alias regressions pass in hosted CI.", "AUD-0203, AUD-0204, and AUD-0207 no longer reproduce."],
      "limitations": []
    },
    {
      "area": "resource-management",
      "status": "completed",
      "checks": ["Temporary fixture cleanup", "Adoption rollback and recovery tests", "Process and file-boundary review"],
      "evidence": ["Recovery, rollback, and temporary-project tests passed in npm run check."],
      "limitations": ["No long-running memory or handle profiler was used."]
    },
    {
      "area": "performance",
      "status": "partial",
      "checks": ["Bounded repository scans", "Full test duration observation", "Synchronous evidence collector review"],
      "evidence": ["Repository checks completed successfully; audit evidence collection is bounded by Git metadata queries."],
      "limitations": ["No benchmark, load test, or profiler was run."]
    },
    {
      "area": "dependencies-configuration",
      "status": "partial",
      "checks": ["Lockfile and npm policy", "Action pinning", "Profile dependency closure", "Release evidence"],
      "evidence": ["Security and distribution checks passed with zero package dependencies.", "Pinned scanner assets and GitHub Actions use immutable SHA-256 or commit pins.", "AUD-0205 records release evidence blockers."],
      "limitations": ["No package registry or advisory service was contacted."]
    },
    {
      "area": "code-hygiene",
      "status": "completed",
      "checks": ["Workspace diagnostics", "git diff --check", "Changed contract and schema review"],
      "evidence": ["No diagnostics or whitespace errors; only line-ending normalization warnings were emitted."],
      "limitations": ["No ESLint, Semgrep, or PSScriptAnalyzer execution."]
    },
    {
      "area": "design-maintainability",
      "status": "completed",
      "checks": ["Skill ownership boundaries", "Dependency cycle checks", "Schema version compatibility", "Generated-project propagation"],
      "evidence": ["43 skills passed ownership and dependency verification.", "Adoption propagation test passed."],
      "limitations": []
    },
    {
      "area": "tests-operability",
      "status": "partial",
      "checks": ["Full local test suite", "Release candidate build and verification", "Cross-platform evidence freshness"],
      "evidence": ["107 local gate tests passed with one platform-alias skip and 5 specialist scanner tests completed.", "151 candidate files verified.", "Security Validation run 33980792156 passed nine OS/Node jobs, three Gitleaks jobs, and aggregate evidence for 5190959.", "CodeQL run 33980792246 passed with zero open alerts after reviewed dispositions."],
      "limitations": ["Trusted signing, independent review, production verification, and distribution monitoring remain unavailable.", "No browser accessibility, deployment, or soak evidence."]
    }
  ],
  "repositoryEvidence": {
    "localGit": {
      "status": "partial",
      "revision": "519095930b7deb08606380e7ea9f014ff2b07416 plus report-only evidence updates",
      "worktreeDirty": true,
      "shallow": false,
      "reachableCommitCount": 31,
      "scannedRefs": ["refs/heads/*", "refs/remotes/*", "refs/tags/*"],
      "limitations": ["Remote-only refs were not fetched.", "Unreachable and pruned objects were not assessed."]
    },
    "secretScanning": {
      "status": "completed",
      "scanner": "Gitleaks",
      "version": "8.30.1",
      "configurationDigest": "e9ba7656309b23cb5b7d00aa9b7dde346caaec9c88dbd435ebaea98dde6975a4",
      "scopes": ["worktree", "staged", "untracked-distributable", "tracked-reports", "all-local-refs", "reachable-history"],
      "findingCount": 0,
      "limitations": ["Remote-only refs were not fetched.", "Unreachable and pruned objects were not assessed."]
    },
    "hostedRepository": {
      "provider": "github",
      "status": "completed",
      "checkedAt": "2026-09-05T17:05:00.000Z",
      "controls": [
        {"id":"GITHUB-BRANCH-CHECKS","title":"Required branch checks and history protection","status":"conformant","evidence":["Main requires strict Aggregate cross-platform evidence and JavaScript security analysis checks with admin enforcement, linear history, conversation resolution, and no force pushes or deletions."],"limitations":[]},
        {"id":"GITHUB-SECRET-PROTECTION","title":"Hosted secret prevention and detection","status":"conformant","evidence":["Secret scanning and push protection are enabled; local pinned Gitleaks adds worktree and history coverage."],"limitations":["Non-provider patterns and validity checks remain unavailable or disabled."]},
        {"id":"GITHUB-DEPENDENCY-PROTECTION","title":"Dependency vulnerability management","status":"conformant","evidence":["Vulnerability alerts, Dependabot security updates, and automated security fixes are enabled."],"limitations":[]},
        {"id":"GITHUB-ACTIONS-POLICY","title":"Least-privilege Actions policy","status":"conformant","evidence":["Actions are restricted to GitHub-owned actions and workflows use commit-pinned actions with read-only default tokens except scoped CodeQL security-events write."],"limitations":[]},
        {"id":"GITHUB-CODEQL","title":"Code scanning analysis","status":"conformant","evidence":["CodeQL run 33980792246 passed for 5190959; all 11 warnings were reviewed and dispositioned with zero open alerts."],"limitations":[]},
        {"id":"GITHUB-HUMAN-REVIEW","title":"Independent source review","status":"non-conformant","evidence":["Only one write-capable collaborator exists and required pull-request reviews are not configured."],"limitations":["A second qualified reviewer identity is required before enforcement can be enabled without lockout."]}
      ],